,title,link,text
12,"Israel and Hamas reach deal on Gaza ceasefire, hostage release","0    https://www.yahoo.com/news/israel-hamas-reach-...
Name: Link, dtype: object","After months of deadlock and more than 15 months of war, Israel and the militant group Hamas reached a fresh Gaza ceasefire and hostage release deal, President Joe Biden said on Wednesday. The deal includes a six-week initial ceasefire phase, the gradual withdrawal of Israeli forces from populated areas of Gaza and the release of hostages held by Hamas in exchange for hundreds of Palestinian detainees held by Israel, Biden said. ""The road to this deal has not been easy. I've worked in foreign policy for decades, this is one of the toughest negotiations that I've ever experienced,"" Biden said from the White House. ""I've reached this point because ... of the pressure that Israel built on Hamas, backed by the United States."" Biden said that Americans would be part of the initial release. He did not say how many. Seven Americans are being held hostage by Hamas. Four have been confirmed dead. Three were believed to be alive: Edan Alexander, 21, Keith Siegel, 64, and Sagui Dekel-Chen, 36. A senior administration official told reporters Wednesday afternoon that Siegel and Dekel-Chen would be released in the first phase of the deal, which applies to women, elderly males and the sick and wounded. Alexander will not be released in the first wave because he is an Israeli soldier. The agreement, which is expected to unfold in three phases beginning Sunday, was mediated by the U.S., Qatar and Egypt. The truce is intended to halt fighting that has devastated Gaza and destabilized the Middle East. It comes just days before President-elect Donald Trump is sworn in as 47th president of the United States. The deal also comes after several waves of negotiations stalled and failed to reach a sequel to an agreement reached in November 2023 during which 105 hostages were released in a weeklong truce. As part of that agreement, 150 Palestinian prisoners held in Israel were freed before fighting resumed. The first phase of the deal was expected to see 33 civilians and 5 female Israeli soldiers held in Gaza released in the first 42 days. In return, Israel will free as many as 1,000 Palestinians held in Israeli jails and its troops will withdraw from city centers in Gaza, a key coastal road and a strategic strip of land along the border with Egypt. Biden said the exact details would be forthcoming. A senior administration official told reporters negotiators would meet on Thursday in Cairo to discuss implementation of the complex agreement. A list of hostages and prisoners who will be released in the first phase of the deal has not been made public, but the official said the U.S. knows exactly who will be freed when the agreement kicks in. Negotiations to reach the second phase, when the remaining hostages would be released, would likely begin on the 16th day of the implementation of the deal. In the second phase, more Israeli troops would also pull out of the Palestinian territory and the temporary ceasefire would become permanent. Biden said the second phase, if it's reached, would mark a permanent end to the war. Phase three would involve the transfer of the remains of deceased hostages to their families and the reconstruction of Gaza. If initial negotiations take more than six weeks, they will continue, Biden said, for as long as a resolution to the conflict takes. ""There was no other way for this war to end than with a hostage deal. And I'm deeply satisfied this day has finally come for the sake of the people of Israel and the families waiting in agony and for the sake of the innocent people in Gaza, who suffered unimaginable devastation because of the war,"" Biden said. Hamas kidnapped 251 people and killed more than 1,200 on Oct. 7, 2023, when it attacked communities in southern Israel, triggering a massive military response from Israel. Israel's government believes 94 hostages are still in Gaza, 60 of whom are assumed to be alive. Four of the hostages were taken in earlier incidents. Their 20-year-old is a hostage in Gaza: Here's what they know about her condition. More than 46,000 Palestinians have been killed in Israel's military operation, according to figures from the Hamas-run Ministry of Health. Most of Gaza's 2.3 million population have been displaced. The war in Gaza has upended the entire Middle East region, mushrooming into Israeli conflicts with Iran-backed Hezbollah militants in Lebanon, Iran-supported Houthi rebels in Yemen and Iran itself. The war also appeared to create conditions that led to the downfall of Syrian President Bashar Assad. Trapped in Gaza for a year: Here's her harrowing story Trump and Biden have been vying to claim credit for the agreement before Monday, when Trump takes office. Trump said last month that he wanted a ceasefire between Israel and Hamas to be reached before he takes office. Otherwise, he said, there would be ""all hell to pay."" Trump was quick to comment on the agreement Wednesday, claiming his election victory was responsible for the deal. ""This EPIC ceasefire agreement could have only happened as a result of our Historic Victory in November,"" Trump said in a social media post. Biden said his administration was responsible for the terms of the agreement but he told his team to coordinate closely with Trump's advisers to make sure the U.S. was speaking with one voice. ""I'd also note this deal was developed and negotiated under my administration, but its terms will be implemented for the most part by the next administration. These past few days, we've been speaking as one team,"" Biden said. White House press secretary Karine Jean-Pierre said ""everybody's going to want some credit"" but added ""the president got it done."" ""This is something that's been in the works for months ‒ for months, way before November,"" Jean-Pierre said at a briefing with reporters. ""We're going back and forth about credit, but people are going to get to go home to their families, and that is so important."" A senior administration official told reporters later in the day that the deal was the result of months of diplomacy from the U.S. and its partners in the region and said that in recent days Biden had spoken to Israeli Prime Minister Benjamin Netanyahu twice. While the Biden administration said the catalyst for the deal was the ceasefire between Israel and Hezbollah in Lebanon and an isolation of Hamas that caused the militant group to agree to release hostages, the official said Trump adviser Steve Witkoff partnered closely with Biden's team and played a significant and helpful role in the diplomacy. ""Hell has been paid to Hamas, tremendously,"" the person said. This article was updated to include video.  This article originally appeared on USA TODAY: Israel and Hamas agree on Gaza ceasefire, hostage release deal"
13,"Israel, Hamas reach ceasefire after 15 months of brutal war in Gaza","0    https://www.yahoo.com/news/israel-hamas-reach-...
Name: Link, dtype: object","Less than 24 hours after a ceasefire deal between Israel and Hamas was announced, Israel delayed a cabinet meeting to approve the agreement as its military continued to attack Gaza, killing at least 77 people, according to local officials. Israeli Prime Minister Benjamin Netanyahu accused Hamas of creating a “last-minute crisis” by “reneging” on parts of the agreement, though he did not offer any details about his claim. Hamas has said it was “committed to the ceasefire agreement, which was announced by the mediators.” Meanwhile, Israel has continued to strike the besieged Palestinian enclave, killing dozens since the deal was announced, Gaza's Civil Defense said. After more than 15 months of destructive fighting that local health officials say has killed more than 46,000 people in Gaza, Israel and Hamas landed on a ceasefire deal on Wednesday. The agreement, announced by Qatari Prime Minister Mohammed bin Abdulrahman bin Jassim Al Thani at a news conference, is set to go into effect on Sunday pending the approval of the Israeli Cabinet. The deal is expected to take place in three phases. Under the first stage, which is set to take place over six weeks, Israeli forces are to withdraw from populated areas in Gaza and be stationed along the border, allowing for a hostage swap and the return of displaced Palestinians to their homes. Hamas will release 33 hostages — two of whom are Americans — including all women, children and elderly people in exchange for the release of a number of Palestinians detained in Israeli prisons, Al Thani said. Increased humanitarian aid and basic supplies will also be allowed to enter Gaza during this phase. Negotiations over the second and third phases of the deal will take place during the six weeks scheduled for the first, according to Al Thani. The Qatari prime minister stressed the delicate period between the announcement of the deal and its implementation. He underscored the need for both Israel and Hamas to commit to all three stages being carried out. “We hope that over the next few days there will not be any aggressions or any military operations,” he said. Senior Hamas official Basem Naim earlier confirmed to NBC News that the group had agreed to a deal, adding that the same terms had been on the table as early as last May. “We are very happy to reach a deal today to stop the aggression against our people, but unfortunately we were able to reach the same deal last May,” Naim said. President Joe Biden praised the deal in remarks on Wednesday afternoon, although at one point he mistakenly referred to Hamas as Hezbollah, the Iran-backed militant group in Lebanon. “It’s a very good afternoon, because at long last I can announce a ceasefire and a hostage deal has been reached between Israel and Hamas after more than 15 months of conflict that began with Hezbollah’s brutal massacre on October the 7th,” he said. During phase two, Biden added, negotiators will work toward “a permanent end to the war.” The agreement on Wednesday brought immediate relief and hope to Palestinians in Gaza who have been living in inhumane conditions, though celebrations were dimmed by continuous deadly airstrikes by Israeli forces. Families of the Israeli hostages who have agonized over the fate of their loved ones for more than a year also expressed mixed feelings and tentative optimism about the return of all the hostages. The families of American hostages held in Gaza said in a statement that they are “deeply grateful that there is finally an agreement” to release their loved ones and thanked Biden and President-elect Donald Trump for their efforts in landing a deal. “The coming days and weeks will be just as painful for our families as the entirety of our loved ones’ horrific ordeals,” they added. “That is why we ask all parties to stay committed to this agreement, every phase until it is fully implemented and everyone has been returned.” Israel and Hamas, who have been in conflict for decades, have engaged in a brutal war since Hamas’ Oct. 7, 2023, terror attack that killed 1,200 people. Israel subsequently launched an indiscriminate military campaign in Gaza, killing tens of thousands of people, destroying critical infrastructure and imposing a severe blockade of essential supplies and humanitarian aid into the Strip. Israel has repeatedly said that it is adhering to the rules of war and has taken all possible measures to limit harm to civilians, but investigations by human rights groups, humanitarian organizations and news outlets have found a pattern of disproportionate attacks by Israeli forces in Gaza. In December 2024, Amnesty International said it concluded that Israel is committing genocide against Palestinians in Gaza, an accusation that the IDF has called “entirely baseless and fail to account for the operational realities faced by the IDF.” Amnesty International also determined that some of Hamas’ actions “constituted war crimes under international law.” Multiple previous rounds of ceasefire talks have fallen apart, save for a hostage exchange deal in November 2023 that saw a brief pause in fighting between Hamas and Israel. This is a developing story. Check back for updates. This article was originally published on MSNBC.com"
14,Israel-Hamas ceasefire and hostage release deal reached,"0    https://www.yahoo.com/news/israel-hamas-ceasef...
Name: Link, dtype: object","Israel and Hamas have reached a ceasefire and hostage release agreement to halt more than a year of fighting in the Gaza Strip, President Biden and Qatar's prime minister announced separately on Wednesday. The deal comes after a week of intense negotiations mediated by Qatar, the U.S. and Egypt. ""Today, after many months of intensive diplomacy by the United States, along with Egypt and Qatar, Israel and Hamas have reached a ceasefire and hostage deal,"" Mr. Biden said in a written statement. ""This deal will halt the fighting in Gaza, surge much needed-humanitarian assistance to Palestinian civilians, and reunite the hostages with their families after more than 15 months in captivity."" Speaking from the White House Wednesday afternoon, Mr. Biden said, ""There was no other way for this war to end than with a hostage deal, and I'm deeply satisfied this day has finally come, for the sake of the people of Israel, and for the families waiting in agony, and for the sake of the innocent people in Gaza who suffered unimaginable devastation because of the war."" He said Americans will be among the hostages released in phase one of the deal, ""and the vice president and I cannot wait to welcome them home."" The deal is expected to take effect Sunday, the White House said. As news of the agreement broke, crowds gathered in Deir al Bala in Gaza, and celebratory gunfire was heard. ""I'm extremely happy,"" one young Palestinian woman in the Gaza city of Khan Younis told CBS News. ""The past 15 months I experienced tears, laughters, lost martyrs and people went into prison, but finally I feel the joy."" ""I am very happy, and today is the day I wished to hear about since the beginning of the war,"" an elderly man said. ""God is sending us hope,"" he added. The ceasefire is not yet in effect, and Israeli airstrikes continued Wednesday in Gaza City and Khan Younis after the news broke. The families of the American hostages still being held in Gaza expressed their relief at the news of a deal. ""We are deeply grateful that there is finally an agreement between Israel and Hamas to bring our loved ones — Omer, Edan, Sagui, Itay, Keith, Gad, and Judi — home,"" the families said in a statement. ""We have been waiting for 467 days while our family members suffer from life-threatening injuries, abuse, torture, and sexual violence. We thank President Biden, President-elect Trump, and their teams for their constructive efforts to make this possible."" A draft of the deal had been agreed to in principle earlier in the week, Arab, U.S. and Israeli officials told CBS News. It sets out a phased framework for a ceasefire and the exchange of hostages still held by Hamas for a larger number of Palestinian prisoners held by Israel. It also includes access for humanitarian aid to Gaza and the eventual ability of Palestinians in Gaza to return to areas they fled. Intense negotiations had been underway in Doha for the past few weeks, with President Biden's top Middle East adviser, Brett McGurk, staying in the region for the better part of a month. McGurk has been closely coordinating with President-elect Donald Trump's pick for special Middle East envoy, Steve Witkoff. Mr. Biden spoke with Israeli Prime Minister Benjamin Netanyahu over the phone on Sunday about the negotiations and again on Wednesday. A senior U.S. official described their latest conversation as ""a very warm call, marking this moment."" In Israel, families of the approximately 100 hostages still being held after Hamas' brutal Oct. 7 2023 attack, which saw the group and allied militants kill about 1,200 people, have been holding regular rallies demanding a negotiated deal for the release of their loved ones. The Israel Defense Forces has said it believes around a third of the hostages have already died. More than 46,000 Palestinians in Gaza have been killed in Israeli strikes since the war began, according to the Hamas-run Gaza health ministry, and most of Gaza's population is displaced and living in camps. Humanitarian groups have been struggling to deliver aid, and experts have warned of famine. What is in the Israel-Hamas ceasefire deal? Details of the deal are similar to a plan outlined by Mr. Biden last year. The deal is expected to go into effect on Sunday. According to a draft from mediator sources, viewed by CBS News earlier this week, and Mr. Biden's description, it would consist of three phases, each lasting about 42 days. During the first phase, Hamas would release 33 women and children hostages, as well as hostages over 50 years old, the draft viewed by CBS News said. The first phase will also include the withdrawal of all Israeli forces from populated areas of Gaza, Mr. Biden said. For each woman or child hostage returned to Israel, Israel is expected to release 30 Palestinian women and children from its prisons. Hamas would release all hostages over 50 years of age, and Israel would release 30 Palestinian prisoners aged 50 or older. A senior Israeli official told CBS News that the release of hostages from Israel would begin on the first day of a 42-day ceasefire period. Mr. Biden said Americans will be among the first wave of hostages released. On that first day, Hamas would release three hostages, according to the draft viewed by CBS News. On the seventh day, Hamas would release four hostages. Thereafter, Hamas would release three hostages taken from Israel every seven days, starting with the living and then moving on to return the bodies of those who have died. During the exchange of hostages and prisoners, there would be a complete ceasefire in Gaza to allow aid to enter, the draft viewed by CBS News said. International aid groups and the United Nations would resume operations in Gaza, and would begin reconstruction of the enclave's infrastructure, such as water, electricity and sewage systems. The second phase of the deal would involve the release of all remaining male Israeli hostages and the withdrawal of all IDF forces from Gaza, the president announced Wednesday. The third phase would include the exchange of bodies of deceased hostages and prisoners and the beginning of the reconstruction of Gaza, Mr. Biden said. Trump responds to ceasefire and hostage release deal In his remarks, Mr. Biden noted that the deal will largely be implemented after his successor, President-elect Donald Trump, takes office. ""This deal was developed and negotiated under my administration, but its terms will be implemented, for the most part, by the next administration,"" the president said. ""For these past few days, we've been speaking as one team."" Trump posted on social media as news broke of the hostage and ceasefire agreement. ""This EPIC ceasefire agreement could have only happened as a result of our Historic Victory in November, as it signaled to the entire World that my Administration would seek Peace and negotiate deals to ensure the safety of all Americans, and our Allies,"" Trump wrote. ""I am thrilled American and Israeli hostages will be returning home to be reunited with their families and loved ones."" Trump said his special envoy to the Middle East, Steve Witkoff, will continue to work closely with Israel ""to make sure Gaza NEVER again becomes a terrorist safe haven."" ""We have achieved so much without even being in the White House,"" Trump wrote. ""Just imagine all of the wonderful things that will happen when I return to the White House, and my Administration is fully confirmed, so they can secure more Victories for the United States!"" Trump is at his Mar-a-Lago estate Wednesday, with five days to go until he becomes president. Asked how much credit Trump should get for the deal, White House national security communications adviser John Kirby told CBS News' Caitlin Huey-Burns: ""I would hope we would all move beyond the question of who gets credit. I mean, I don't think that the hostages are caring about that, and I don't think their families care about that. I don't think the Palestinians in Gaza care about who gets credit for this. The truth is that there's a lot of credit to go around, including in the [Mideast] region."" Kirby said the Biden administration worked closely with their counterparts on Trump's team. ""It's important to remember that this deal was the deal that President Biden negotiated and put on the table back in May, got international support for it. That's the deal that we're talking about being implemented here,"" Kirby said. ""And it was due to a lot of intense diplomacy by American diplomats."" Margaret Brennan, Marwan Al-Ghoul, Mais Al-Bayaa and Michal Ben-Gal contributed to this report. The major takeaways from Biden's farewell address Breaking down Biden's farewell address Biden issues a warning to Americans about abuses of power, military industrial complex and AI"
15,"Israel-Hamas ceasefire must lead to 'political resolution' in Gaza, Macron says","0    https://www.yahoo.com/news/qatar-announces-isr...
Name: Link, dtype: object","French President Emmanuel Macron said Wednesday that a ceasefire deal reached by Israel and Hamas must be followed by a ""political solution"" to end the conflict in Gaza. ""The agreement must be respected. The hostages freed. Gazans aided. A political solution must happen,"" Macron posted on X His reaction comes after Qatar's prime minister said Wednesday that Israel and Hamas had agreed to a ceasefire in Gaza starting on Sunday and a hostage and prisoner exchange after 15 months of war. The agreement follows months of on-off negotiations brokered by Egyptian and Qatari mediators, with the backing of the United States, and came just ahead of the 20 January inauguration of US President-elect Donald Trump. United Nations Secretary-General Antonio Guterres while welcoming the deal said it was ""imperative"" that the ceasefire removes obstacles to aid deliveries as he welcomed the deal that includes a prisoner and hostage exchange. Ceasefire deal The deal, not yet formally announced, outlines a six-week initial ceasefire phase and includes the gradual withdrawal of Israeli forces from Gaza and release of hostages held by Hamas in exchange for Palestinian detainees held by Israel, an official briefed on the negotiations told Reuters news agency. Israel’s government is expected to vote on the deal on Thursday. As celebrations spread in Gaza's Khan Yunis, Israel said several clauses in the ceasefire deal with Hamas remain ""unresolved"". Read more on RFI EnglishRead also:Displaced Gazans have little space left to go, UN saysGaza’s powerful war narratives make their way to the OscarsRSF says Israel responsible for one-third of journalist deaths in 2024"
