,title,link,text
0,Biden balks when asked if Trump deserves credit for Israel-Hamas cease-fire...,"0    https://www.foxnews.com/politics/biden-balks-a...
Name: Link, dtype: object","['President Biden had a curt response to a question posed by Fox News senior White House correspondent Jacqui Heinrich on Wednesday regarding whether President-elect Trump deserves credit for the recent Israel-Hamas cease-fire deal.', 'President Biden balked at a question posed by Fox News senior White House correspondent Jacqui Heinrich on Wednesday about whether President-elect Trump deserves credit for the recent Israel-Hamas cease-fire deal.', ""The deal comes during Biden's final days in office, less than a week before Trump's second term starts on Jan. 20. A recent meeting between Israeli Prime Minister Benjamin Netanyahu and Trump's incoming Middle East envoy, Steve Witkoff, was reportedly an integral part of the deal, sources told Fox News Digital."", '""Who in the history books gets credit for this, Mr. President, you or Trump?"" Heinrich asked Biden at Wednesday afternoon\'s White House news conference.', '""Is that a joke?"" the president responded.', ""ISRAEL SENDS REPORT TO UN ON 'BRUTAL' TREATMENT USED BY TERRORISTS AGAINST HOSTAGES IN GAZA"", 'When Heinrich denied that her question was in jest, Biden responded, ""Oh. Thank you,"" and walked away.', 'President Biden, flanked by Vice President Kamala Harris and Secretary of State Antony Blinken, speaks about the Israel-Hamas cease-fire and hostage release deal at the White House in Washington, D.C., on Wednesday. (Roberto Schmidt/AFP via Getty Images)', 'Minutes earlier, Biden explained that the cease-fire would consist of two phases. The first phase, which will last around six weeks, ""includes a full and complete cease-fire, withdrawal of Israeli forces from all the populated areas of Gaza, and the release of a number of hostages held by Hamas, including women and elderly and the wounded.""\xa0', '""And I\'m proud to say Americans will be part of that hostage release and phase one as well,"" the president said. ""And the vice president and I cannot wait to welcome them home.""', 'Israel has also released hundreds of Palestinian prisoners, Biden said, and Palestinians ""can also return to their neighborhoods in all areas of Gaza, and a surge of humanitarian assistance into Gaza will begin."" The second phase of the cease-fire will begin after Israel negotiates ""the necessary arrangements,"" which Biden said would mark ""a permanent end of the war.""', '""There are a number of details to negotiate the move from phase one to phase two,"" he continued. ""But the plan says if negotiations take longer than six weeks, the cease-fire will continue as long as the negotiations continue.""', ""FOX NEWS GETS AN INSIDE LOOK AT IDF'S WAR AGAINST HAMAS"", 'Relatives and friends of people killed and abducted by Hamas and taken into Gaza react to the ceasefire announcement as they take part in a demonstration in Tel Aviv, Israel, on Wednesday. (AP Photo/Oded Balilty)', 'Weeks ago, Trump warned that there would be ""hell to pay"" if there were no significant developments with a hostage deal by the time he took office.', '""Everybody is talking about the hostages who are being held so violently, inhumanely, and against the will of the entire World, in the Middle East – But it’s all talk, and no action!"" Trump wrote in a Truth Social post.\xa0', '""Please let this TRUTH serve to represent that if the hostages are not released prior to January 20, 2025, the date that I proudly assume Office as President of the United States, there will be ALL HELL TO PAY in the Middle East, and for those in charge who perpetrated these atrocities against Humanity,"" Trump added.\xa0', ""Shortly after Biden announced the deal, State Department spokesman Matthew Miller acknowledged the role that Trump's team played in the negotiations and thanked them."", '""I don\'t know if it\'s unprecedented to have envoys from an outgoing and an incoming administration sitting at the same table negotiating a cease-fire agreement of this kind,"" Miller said Wednesday. ""But if it\'s not unprecedented, it\'s certainly unusual.""', '\xa0CLICK HERE TO GET THE FOX NEWS APP', 'President Biden delivers remarks on the recently announced cease-fire deal between Israel and Hamas in Washington, D.C., on Wednesday. (Anna Moneymaker/Getty Images)', '""And, we, of course, thank the Trump team for working with this on this cease-fire agreement. We think it\'s important that they were at the table.""', ""Fox News Digital's Danielle Wallace, Greg Norman, Trey Yingst, Brooke Curto, Efrat Lachter and Sophia Compton contributed to this report."", 'Andrea Margolis is a writer for Fox News Digital and Fox Business. Readers can send story tips to andrea.margolis@fox.com.']"
1,"Biden hails Gaza deal, says worked with Trump","0    https://www.yahoo.com/news/biden-hails-gaza-de...
Name: Link, dtype: object","US President Joe Biden announced Wednesday a ""full and complete"" ceasefire between Israel and Hamas in the first part of their peace accord, and said he had acted as ""one team"" with incoming leader Donald Trump. Speaking at the White House just days before he leaves office, a visibly relieved Biden said the negotiations to halt the Gaza conflict had been some of the ""toughest"" of his career. ""I'm deeply satisfied this day has come, finally come,"" Biden said in a televised statement. A number of Americans would be among the hostages who would be released by Palestinian militants in Gaza, he added. The first phase of the deal would last six weeks and include a ""full and complete ceasefire, withdrawal of Israeli forces from all the populated areas of Gaza and the release of a number of hostages held by Hamas,"" Biden said. The as yet unfinalized second phase would bring a ""permanent end to the war,"" the 82-year-old Democrat said, adding he was ""confident"" the deal would hold. Biden's administration has been criticized for its channeling of military aid to Israel during its offensive in Gaza, which was sparked by Hamas's deadly October 7, 2023 attack on Israel. But he said pressure on Hamas and its Iranian backers had helped push through a truce, adding that the deal now agreed was the ""exact"" same as one he had proposed in May. Biden, flanked by Vice President Kamala Harris and Secretary of State Antony Blinken, meanwhile said his administration had been working as ""one team"" with Trump's ahead of the Republican starting his second term as president on January 20. ""In these past few days, we've been speaking as one team,"" said Biden, noting that most of the implementation of the deal would be under a Trump White House. ""I told my team to coordinate close with the incoming team to make sure we're all speaking with the same voice -- because that's what American presidents do."" Trump earlier claimed credit for the ""epic"" deal, in posts on social media. His Mideast envoy was involved in the talks and consulted with the White House. Asked by a reporter whether he or Trump was mainly responsible for the deal, Biden replied: ""Is that a joke?"" aue-dk/mlm"
2,Biden pointedly notes that he ‘introduced’ Israel-Hamas ceasefire deal after...,"0    https://www.yahoo.com/news/biden-says-israel-h...
Name: Link, dtype: object","Hamas and Israel have reached a ceasefire deal brokered by the United States with the aid of the Egyptian and Qatari governments, ending 15 months of violence that began with the October 7, 2023, terror attacks, President Joe Biden announced Wednesday afternoon. Speaking from the White House not long after news of the agreement became public, Biden said it was “a very good afternoon” because he could announce the deal had finally been reached. The inking of a ceasefire deal brings to a halt more than a year of war in Gaza, during which the Hamas-run Gaza Health Ministry says over 46,000 Palestinians have been killed and more than 100,000 wounded. The three-phase deal will begin with “a full and complete ceasefire, withdrawal of Israeli forces from all the populated areas of Gaza, and the release of a number of hostages held by Hamas, including women and elderly and the wounded” over a period of six weeks, Biden explained. The second phase, which is still being negotiated, would see a “permanent end to the war,” he added. Biden said the deal would end “more than 15 months of conflict” that began with the “brutal assault” on Israel, as well as “more than 15 months of terror for the hostages, their families and the Israeli people,” and “more than 15 months of suffering by the innocent people of Gaza.” He added that he and Vice President Kamala Harris “cannot wait” to welcome American hostages home. He stressed that the ceasefire would continue past the six-week period if the negotiations take longer. The second phase of the deal would involve releasing “all remaining living hostages,” and a withdrawal of all Israeli forces from Gaza. At that point, the ceasefire would become permanent, Biden said. He added that a third phase would consist of the return of the remains of any deceased hostages, plus the start of a “major reconstruction plan” for Gaza. Biden also made a point of noting in his Wednesday speech that the ceasefire agreement is one he “introduced” last spring, but said his team has been working closely with the incoming Trump administration in the final days of the deal negotiations. “In these past few days, we’ve been speaking as one team,” he said. For his part, Trump attempted to take sole credit for the agreement in a post to his Truth Social platform, writing that the “EPIC” agreement “could have only happened as a result of our Historic Victory in November, as it signaled to the entire World that my Administration would seek Peace and negotiate deals to ensure the safety of all Americans, and our Allies.” “With this deal in place, my National Security team, through the efforts of Special Envoy to the Middle East, Steve Witkoff, will continue to work closely with Israel and our Allies to make sure Gaza NEVER again becomes a terrorist safe haven,” he added. Asked about Trump’s boasts and claims to be responsible for the deal, Biden grinned and pointed out that the agreement largely follows the framework he proposed last May. He credited American support for Israel with having helped to “badly weaken Hamas and its’ backers and create the conditions for this deal,” and stressed that he’d known all along that the deal would have to be implemented by Trump and his team. “So I told my team to coordinate closely with the incoming team to make sure we’re all speaking with the same voice,” he said. “Because that’s what American presidents do.” In a separate statement, the president said the agreement had been the product of “intense diplomacy.” The agreement — which Biden called a result of both “the extreme pressure that Hamas has been under and the changed regional equation after a ceasefire in Lebanon and weakening of Iran” along with “dogged and painstaking American diplomacy” — tracks the details first laid out in a United Nations Security Council-endorsed plan put forth by the United States last year. On Monday, White House National Security Adviser Jake Sullivan told reporters that efforts to close the deal were ongoing and had “accelerated” in recent weeks, with McGurk, a veteran diplomat and foreign policy expert who has served in multiple administrations, having “camped out” in Doha while “working to tighten up these details and try to get this done.” Sullivan said Biden’s team had “coordinated very closely” with the incoming Trump team to “present a united message to all the parties, which says it is in the American national security interest — regardless of party, regardless of outgoing or incoming administration” and “get this deal done as fast as possible.” The way the talks had run up against an American presidential transition had brought to mind the chaotic scenario faced by Ronald Reagan when he succeeded Jimmy Carter after defeating him in the 1980 election amid the Iran hostage crisis. At the time and in the years since, it has been argued by some historians that the Reagan team back-channeled with Iran to keep the hostages captive until Reagan took office — as they were in fact released just minutes after he was sworn in. Asked whether he or Biden were concerned that the negotiations were being hampered by American political considerations, Sullivan said he doubted the thought had even crossed Biden’s mind. “What was on his mind is we’re in this period of change and transition, and we can’t have anything missed between the cup and the lip in the handoff between our administration and the incoming administration. So, he told us, he told me, ‘Sit down with your successor as soon as you possibly can and start working through and mapping out what they need to know and how we can work together in this period of transition to put ourselves in the best position possible,’” he said. “These are not partisan issues; these are American national security issues. And it’s the kind of spirit that President Biden has brought to this job from the very beginning that set the politics aside, do what’s right for the country, and have our team work with the incoming team in that regard,” Sullivan continued, adding that the engagement between the Biden and Trump teams had been “professional” as well as “deep and substantive.”"
3,Everything we know about North Korean soldiers captured by Ukraine,"0    https://www.aol.com/everything-know-north-kore...
Name: Link, dtype: object","Ukraine has found “irrefutable evidence” of North Korea’s involvement in Russia’s war against his country, president Volodymyr Zelensky said this week as he announced the capture of two North Korean soldiers. The two men were reportedly captured during fighting in Russia’s Kursk border region, where the Ukrainian forces launched an incursion last August. North Korea has deployed some 12,000 troops to aid Russia’s war effort, Ukraine has said, echoing assessments by American and South Korean intelligence agencies. Kyiv previously claimed to have caught a North Korean soldier in Kursk on 27 December, but later said he had died of his wounds. The two soldiers captured on Saturday were brought to Kyiv for interrogation. Pictures released on social media by Mr Zelensky show two men resting on cots in a prison cell with bars over the windows. Both wear bandages, one around his jaw and the other around his hands and wrists. Mr Zelensky did not give their names but the Ukrainian intelligence service claimed that one of them carried a Russian military ID card issued in the name of a person from the Tuva republic bordering Mongolia. The other man possessed no documents when he was captured. Moscow was “trying to hide the fact these are soldiers from North Korea by giving them documents claiming they are from Tuva or other territories under Moscow’s control. But these people are actually Koreans, they are from North Korea,” the president’s office said, without offering any evidence. Since the captured soldiers did not speak English, Russian or Ukrainian, they were interviewed with the help of a Korean translator, the Security Service of Ukraine said. The soldier with the ID card purportedly said he was born in 2005 and was serving in the North Korean military as a rifleman since 2021. The other prisoner answered his interrogators in writing due to a severe injury to his jaw. He purportedly said that he was serving in the North Korean army since 2016 as a scout sniper. One of the soldiers purportedly said during his interrogation that he had been told he was on a training exercise and did not know he was fighting the Ukrainian forces. The testimony was confirmed by the other soldier, the security service said. The man claimed to have hid in a shelter during fighting and stayed there until he was found by the Ukrainians a few days later. His unit had suffered significant losses and food and water shortages for several days before his capture, he purportedly said. The unit had received a single week of training alongside Russian troops before being deployed to the frontline. “This task was not easy,” Mr Zelensky said about the capture of the two men. “Usually, Russia and other North Korean military personnel finish off their wounded and do everything possible to ensure that no evidence of the participation of another state, North Korea, in the war against Ukraine is preserved.” South Korea’s intelligence agency claimed to have found North Korean memos calling on its soldiers to kill themselves before capture by the Ukrainians. Mr Zelensky said that he was ready to send the two soldiers to North Korean leader Kim Jong Un if he were to facilitate a prisoner exchange with Russia. “Ukraine is ready to hand over Kim Jong Un’s soldiers to him if he can organise their exchange for our warriors who are being held captive in Russia,"" he said on X on Sunday. “For those North Korean soldiers who do not wish to return, there may be other options available,” he added. “In particular, those who express a desire to bring peace closer by spreading the truth about this war in Korean will be given that opportunity.”"
4,"For LA water issues, misinformation spreads nearly as fast as the wildfires","0    https://www.yahoo.com/news/la-water-issues-mis...
Name: Link, dtype: object","A billionaire couple was accused of withholding water that could help stop Los Angeles' massive wildfires. Democratic leadership was blamed for fire hydrants running dry and for an empty reservoir. Firefighters were criticized for allegedly using “women's handbags"" to fight the fires. Those are just a few of the false or misleading claims that have emerged amid general criticism about California's water management sparked by the fierce Los Angeles fires. Much of the misinformation is being spread “because it offers an opportunity to take potshots at California Democratic leadership while simultaneously distracting attention from the real contributing factors, especially the role of climate change,” said Peter Gleick, senior fellow at the Pacific Institute, a nonprofit he co-founded that focuses on global water sustainability. Attacks on a water bank Social media users have claimed that Stewart and Lynda Resnick, co-owners of a massive agriculture company that has a majority stake in California’s Kern Water Bank, control California’s water and have refused to lend enough to firefighting efforts. The water bank stores up to 1.5 million acre-feet of water underground for agricultural, municipal and industrial use during dry years. The water gets used by the Resnicks' company, The Wonderful Company, known for such brands as Fiji Water and Wonderful Pistachios. It also serves Bakersfield and other farmers in Kern County. But the water bank is more than 100 miles north of Los Angeles and plays no part in its water supply. The Wonderful Company said there was “zero truth” that it controls California water or has anything to do with water going to Los Angeles. Kern Water Bank didn't respond to a request for comment. The Wonderful Company has faced criticism over its extensive water use, especially in times of drought, and its control of what many consider a public resource. But Gleick said neither the Resnicks nor their company have anything to do with water supply issues around the wildfires. “There are many problems with how California allocates water among users and especially the control of water by large agribusinesses, exemplified by the Resnicks, but those problems are completely unrelated to the LA fires and efforts to control them,” he said. Claims over dry hydrants, empty reservoir Some fire hydrants in Los Angeles ran dry in early efforts to fight the fires, prompting a swirl of criticism on social media, including from President-elect Donald Trump, against the water management policies of Los Angeles Mayor Karen Bass and California Gov. Gavin Newsom. State and local officials and experts said critics were connecting unrelated issues and spreading false information. State water distribution choices were not behind the hydrant problems, they said, nor was a lack of overall supply in the region. Officials said the hydrants were overstressed for hours as aerial firefighting wasn't possible because of high winds. The Los Angeles Department of Water and Power said they were pumping plenty of water into the system, but demand was so high that it wasn’t enough to refill three million-gallon tanks in Pacific Palisades that help pressurize hydrants there. Janisse Quiñones, head of the Los Angeles Department of Water and Power, said at a news conference that 3 million gallons of water were available when the Palisades fire started but demand was four times greater than ever seen. Hydrants are designed for fighting fires at one or two houses at a time, not hundreds, Quiñones said, and refilling the tanks also requires asking fire departments to pause firefighting. Bass said 20% of hydrants went dry. Critics also questioned why the 117-million gallon Santa Ynez Reservoir that contributes water for drinking and firefighting in Pacific Palisades was empty when the fires broke out. Some social media users said officials should be jailed over the empty reservoir, or alleged that officials view diversity, equity and inclusion policies as more important than getting things done. The reservoir has been empty for nearly a year awaiting repairs to a rubber cover that were required to provide safe drinking water, according to the Los Angeles Department of Water and Power, which owns and operates it. The agency also said competitive bidding requires time. Marty Adams, who retired last spring, was the general manager and chief engineer at LADWP when the reservoir was drained. He said it was difficult to see the full scope of damage without draining the reservoir, and once that was done officials realized the repairs would be a bigger job than expected. Adams said the reservoir likely could not have been refilled fast enough to be of much use fighting fires. Newsom has called for an independent investigation into the hydrants and the reservoir. At least one lawsuit has already been filed over the reservoir issue. Fighting flames with purses? Video of firefighters throwing water onto flames with small bags spread widely on social media. Some posts ridiculed the use of “women's handbags” and alleged money that could have been used to buy proper equipment was spent elsewhere, such as on diversity, equity and inclusion initiatives or foreign aid. But the state said the small canvas bags seen in the videos are routinely used by the Los Angeles Fire Department to fight small trash fires, and can be more efficient than a long hose in some situations. Los Angeles County Supervisor Lindsey Horvath, whose district includes the Palisades fire, said misinformation is demoralizing for firefighters. “When they hear that there’s a suspicion that they didn’t put their best foot forward, that they weren’t at their best, that they weren’t excellent in terms of the service that they deliver, of course that’s crushing,” she said. Michelle Ciulla Lipkin, executive director of the National Association for Media Literacy Education, called the misinformation “irresponsible"" and said it affects the actions people take and the way they cope with trauma. “The spread of false information at a time of crisis is nothing short of deadly,” she said. ___ The Associated Press receives support from the Walton Family Foundation for coverage of water and environmental policy. The AP is solely responsible for all content. For all of AP’s environmental coverage, visit https://apnews.com/hub/climate-and-environment"
