,title,link,text
29,Takeaways from the second day of Trump Cabinet confirmation hearings,"0    https://www.yahoo.com/news/takeaways-second-da...
Name: Link, dtype: object","Donald Trump’s Cabinet nominees for key roles in the intelligence, foreign policy and law enforcement agencies all pledged to keep politics out of their offices amid concerns from Democrats that the president-elect will carry out his vows to go after his political enemies once in office. Trump’s nominee for attorney general, Pam Bondi, repeatedly insisted she would not allow politics to infect her Justice Department – accusing President Joe Biden’s DOJ of being responsible for politicizing law enforcement against Trump. “Every case will be prosecuted based on the facts and the law that’s applied in good faith, period. Politics have got to be taken out of the system,” Bondi said before the Senate Judiciary Committee. “This department has been weaponized for years and years and years, and it has to stop.” In addition to Bondi’s pledge not to be influenced by politics, Trump’s nominee for CIA director, John Ratcliffe, said he would not impose “political litmus tests” at the agency, while secretary of state nominee and Republican Sen. Marco Rubio of Florida, defended the importance of NATO, an alliance Trump has often questioned. The confirmation hearings for Trump’s Cabinet picks kicked off Tuesday with a highly contentious session for defense secretary nominee Pete Hegseth. On Wednesday, the slate of a half-dozen hearings struck a much more conciliatory tone, where the concerns raised by senators were about the conduct of the president-elect and not the nominees themselves. There were still heated moments Wednesday, particularly with Bondi and questions about claims of 2020 election fraud and Trump’s calls for jailing his enemies including special counsel Jack Smith and former Rep. Liz Cheney. “I’m not going to be bullied by you,” Bondi declared during a testify back-and-forth with Sen. Alex Padilla of California. But Democratic senators made clear they were not going to blanketly oppose all of Trump’s nominees, particularly Rubio, a fellow senator. On Wednesday, Democratic Sen. John Hickenlooper of Colorado introduced Trump’s energy secretary nominee, fracking CEO Chris Wright, who is also from Colorado. There are still more contentious hearings looming, including Trump’s nominee for Health and Human Services secretary, Robert F. Kennedy Jr.; his pick for director of national intelligence, Tulsi Gabbard; and for FBI director, Kash Patel – who was invoked by Democrats multiple times during Bondi’s hearing. Here are the takeaways from Wednesday’s slate of confirmation hearings: Democrats repeatedly pressed Bondi on Wednesday about her ability to stand up to Trump, who has said he has an “absolute right” to be involved in Justice Department matters and clashed with his attorneys general in his first administration when they did not bend to his wishes. “I need to know that you would tell the president ‘no’ if you are asked to do something that is wrong, illegal or unconstitutional,” said Sen. Dick Durbin of Illinois, the Judiciary Committee’s top Democrat. Bondi responded by blasting the “weaponization” of the Biden Justice Department and said that she would not improperly target people with criminal probes like those against Trump. “I will not politicize that office,” Bondi said of being attorney general. “I will not target people simply because of their political affiliation.” Bondi also vowed Wednesday to follow the Justice Department’s policy to limit contacts between the White House and the Justice Department. “I believe this Justice Department must be independent and must act independently,” she said. Pressed on whether she would investigate officials Trump has suggested should be jailed – including special counsel Jack Smith and former GOP Rep. Liz Cheney – Bondi said “no one would be pre-judged.” Democratic Sen. Mazie Hirono of Hawaii questioned Bondi over comments she made during the 2024 election cycle that “bad” prosecutors should be held criminally responsible. “Sometimes ‘bad’ is in the eye of the beholder. I am just asking whether you would consider Jack Smith to be one of the people,” Hirono said. “How about Liz Cheney? How about Merrick Garland?” “Senator, I am not going into hypotheticals,” Bondi responded. “No one has been pre-judged, nor will anyone be pre-judged if I am confirmed.” Later, Bondi clashed with Sen. Adam Schiff of California – another of Trump’s longtime targets – over whether her personal political beliefs would affect decisions on January 6 pardons and the preservation of evidence from the special counsel investigations into Trump. At one point in the exchange, Bondi raised the House’s Republican-led censure of Schiff in 2023, while he pressed her on whether there was evidence to start an investigation into Smith. “It would be irresponsible of me to make a commitment regarding anything,” Bondi said. “What I’m hearing on the news is horrible. Do I know if he committed a crime? I have not looked at it.” Bondi was questioned about whether she accepts that Biden won the 2020 election – a fact that Trump continues to falsely dispute after he tried to overturn the 2020 election results. Bondi told lawmakers Wednesday she accepts that Trump lost the 2020 election but falsely claimed “there was a peaceful transition of power” that year, ignoring the January 6, 2021, attack on the US Capitol that disrupted the election certification. “President Biden is the president of the United States,” Bondi said. “He was duly sworn in, and he is the president of the United States. There was a peaceful transition of power. President Trump left office and was overwhelmingly elected in 2024.” She also sowed doubt about the legitimacy of the 2020 results, citing her on-the-ground legal work that year for the Trump campaign in Pennsylvania. Trump has falsely claimed there was massive fraud in the state, and dispatched Bondi and other allies like Rudy Giuliani to try to overturn the results there. “I accept the results. I accept, of course, that Joe Biden is President of the United States,” she said. “But what I can tell you is what I saw firsthand when I went to Pennsylvania as an advocate for the (2020) campaign… I saw many things there. But do I accept the results? Of course I do. Do I agree with what happened? I saw so much.” Bondi was also questioned about pardons for those convicted of crimes related to January 6, as Trump has suggested he will do in some cases once in office. Asked whether she believes “violent assaults on police officers should be pardoned,” Bondi said that she would advise the president as her job requires. “The pardons, of course, fall under the president,” Bondi said. “But if asked to look at those cases, I will look at each case and advise on a case-by-case basis, just as I did my entire career as a prosecutor.” Several Democrats asked Bondi to respond to comments that Trump’s pick for FBI director, Kash Patel, has made about prosecuting the president-elect’s enemies. Bondi defended Patel’s credentials, while suggesting at several points that senators should pose their questions to him when he testified before the panel. Still, Bondi was clear when Sen. Sheldon Whitehouse of Rhode Island pressed her on Patel’s comments about going after the president’s enemies. “There will never be an enemies list within the Department of Justice,” Bondi said. Rubio, who has served as a senator for more than a decade, may have received the warmest reception from his colleagues when he appeared on the other side of the dais Wednesday as Trump’s nominee to lead the State Department. New Hampshire Sen. Jeanne Shaheen, the top Democrat on the Senate Foreign Relations Committee, said Rubio “has the skills” and is “well-qualified to serve as secretary of state.” “I believe this committee has a responsibility to get your team out to the field and we hope you will send us qualified, experienced, and well-vetted nominees to consider,” she said, noting the need to confirm career diplomats. During questions from senators, Rubio voiced his support for NATO – as well as the bipartisan law he co-sponsored, which states that the US cannot withdraw from the alliance without Senate approval or an act of Congress. “I was a co-sponsor of the law, and so it’s tough to say I’m not in support of a law that I helped to pass and that I think it’s an important role for Congress to play,” Rubio told the Senate Foreign Relations Committee. In response to questions about Russia’s war against Ukraine, Rubio said it’s “unrealistic to believe” Ukraine can push Russian forces back to where they were before the 2022 invasion and that the official US position should be that the war should end. Rubio added he and Trump agree about the war needing to come to an end and criticized the Biden administration for not setting a clear “end goal” for the war. “What Vladimir Putin has done is unacceptable, there’s no doubt about it, but this war has to end, and I think it should be the official policy of the United States that we want to see it end,” Rubio said. While Rubio was testifying, the ceasefire deal between Israel and Hamas was announced, which committee chairman Republican Sen. James Risch of Idaho announced to the hearing room. Rubio credited both the Biden administration and the incoming Trump administration’s Middle East envoy Steve Witkoff for the agreement. “I dare to say that all involved deserve credit for the ceasefire that the chairman has just announced,” Rubio told senators. “Before we all celebrate, though, obviously, we’re all going to want to see how that executes,” Risch cautioned. Testifying before the Senate Intelligence Committee, Ratcliffe pledged not to politicize his work and the intelligence that’s produced in the Trump administration. He told the committee he would never allow “political or personal biases to cloud our judgement or infect our products.” Sen. Mark Warner of Virginia, the top Democrat on the committee, urged Ratcliffe to reassure rank-and-file intelligence officials that they “need not fear reprisal for speaking truth to power.” The Virginia Democrat expressed concerns about the attacks that some Trump loyalists have made against the intelligence community, asking Ratcliffe to commit not to fire or force out CIA employees because of their political views. “If you are asked to remove personnel, to get rid of individuals based upon this kind of political litmus test, I’d ask that you keep the committee informed of those, those requests,” Warner said to Ratcliffe. “I certainly will,” Ratcliffe said. “I think my record in terms of speaking truth to power and defending the intelligence community and its good work is very clear,” Ratcliffe added. Across the Capitol complex, several additional Trump Cabinet picks testified ahead of the president-elect’s inauguration next week. During tense questioning on climate change by a California senator, Trump energy pick Chris Wright said he stood by past social media comments that “the hype over wildfires is just hype” to justify climate policies he views as detrimental. Padilla, whose state is currently battling massive wildfires in Los Angeles, asked Wright if he stood by those comments in light of the current deadly and devastating fires. “I stand by my past comments,” Wright said. “Tell that to the families of the more than two-dozen people” who lost their lives, Padilla shot back. Wright later said the fires were “horrific.” Wright, a fracking CEO in Colorado, vowed in his testimony to “unleash American energy” – echoing a talking point Trump often repeated on the campaign trail. Wright said the US should increase energy production, including liquified natural gas and commercial nuclear energy. In another committee room, Trump’s nominee to head up the Office of Management and Budget would not commit Wednesday to releasing billions of remaining dollars approved for Ukraine funding — an early sign of contention between Congress and the incoming administration. Russell Vought, who also served in the powerful budget role during the first Trump administration, said he wouldn’t presuppose the incoming president’s intentions on the matter. “I’m not going to get ahead of the president on a foreign policy issue,” he said. His answer suggested the new administration would make use of the practice known as impoundment, which allows the president to decline to spend money Congress has already appropriated. There is more than $3 billion in approved Ukraine aid remaining that it will fall to Trump to spend when he takes office. And Trump’s nominee for transportation secretary, former Rep. Sean Duffy, discussed troubles with plane manufacturer Boeing, whether he would support more funding for Amtrak, and transparency on the mysterious drones over New Jersey at his hearing Wednesday. Testifying before the Commerce Committee, Duffy, a recent Fox Business co-host and former Wisconsin lawmaker, told committee members that a priority for him would be restoring “global confidence in Boeing.” The plane maker has had a string of incidents in recent years but said it has made strides to change operations and safety-related incidents. “Boeing is a national security issue,” Duffy told the committee. “Boeing is the largest exporter of American product, incredibly important, as in one of my meetings, someone said, though, ‘they need tough love,’ which is what they do need.” This story has been updated with additional developments. CNN’s Priscilla Alvarez, Marshall Cohen, Zachary Cohen, Michael Conte, Jennifer Hansler, Kevin Liptak, Ella Nilsen, Evan Perez, Katelyn Polantz, Hannah Rabinowitz, Manu Raju and Alexandra Skores contributed to this report. For more CNN news and newsletters create an account at CNN.com"
30,Trump credited for ceasefire breakthrough as US officials who resigned over Gaza...,"0    https://www.yahoo.com/news/trump-credited-ceas...
Name: Link, dtype: object","U.S. officials who resigned over the Biden administration’s support for Israel’s war in Gaza slammed the outgoing president for failing to broker a ceasefire sooner, after President-elect Donald Trump played a key role in securing an end to the devastating 15-month conflict. “This is a deal that, in its basic form, has been on the table for many months, and it is an absolute travesty that the Biden administration never used any of the massive leverage it had to push it over the finish line,” Josh Paul, who resigned from the State Department’s in opposition to America’s policy of providing lethal arms to Israel for use in Gaza, said. The agreement “demonstrates clearly that Biden could have achieved a ceasefire all along if his people were really serious about it,” Annelle Sheline, who resigned from the State Department in February 2024, told The Independent. The historic ceasefire was announced Wednesday after 466 days of fighting in the Middle East — with the multi-phase planning including the gradual return of all hostages taken in the October 7 attacks, and a full withdrawal of all Israeli troops from Gaza. Reports from diplomats involved in the negotiations reveal that Trump played a key role in brokering the agreement by piling pressure on the Israeli government to accept the deal — something President Biden had been unable or unwilling to do, much to the frustration of his former officials. “It’s not as if suddenly the terms have shifted significantly, it’s just that now you had an incoming US president that was willing to actually use some pressure,” Sheline, who resigned from the Biden administration over the president’s refusal to lean on the Israeli government to prevent more bloodshed in Gaza, said. Tariq Habash, the first administration appointee to resign in protest over the war, also pointed the finger at Biden, calling it “a failure of the Biden administration that it took so long for us to get to this point.” “I don’t think that the Biden administration was prioritizing reaching a deal expediently,” Habash, a Palestinian-American political appointee at the Department of Education, said. “I think that if they wanted to, they would have leveraged some real influence, particularly with [Israeli prime minister Benjamin] Netanyahu and the Israeli government, and I think that Biden and his advisors made a decision that that was not something that they’re willing to do that allowed for the continuation of the violence against Palestinian civilians for over 15 months,” Habash added. Israeli newspaper Haaretz reported Monday that Trump’s incoming Middle East envoy Steven Witkoff heaped pressure on Netanyahu to accept a deal that he had rejected numerous times over the past year. The paper described “a change in the rules of the game that has broken the deadlock in the hostage negotiations.” Paul, who left the State Department’s Bureau of Political Military Affairs in the first month of the war, told The Independent it was “clear” that Trump’s team played a role in brokering the agreement. “How much of that was commission as opposed to Netanyahu’s desire to give Trump a ‘win’ - a desire that has probably been a consideration for him since very early in this conflict - remains to be known,” he said. The outgoing Biden administration took the unusual step of letting Trump’s team take a lead role in negotiations, Haaretz reported. The Washington Post also cited a diplomat briefed on the ceasefire negotiations crediting the influence of Trump’s team, saying it was “the first time there has been real pressure on the Israeli side to accept a deal.” Biden made only a passing remark about the involvement of Trump’s team when announcing the deal. “This deal was developed and negotiated under my administration, but its terms will be implemented, for the most part, by the next administration,” he said.  “In these past few days, we have been speaking as one team.” When asked by a reporter who takes credit for the deal, him or Trump, Biden replied: “Is that a joke?” Biden could have achieved a ceasefire all along if his people were really serious about it Annelle Sheline, who left her role at the U.S. State Department over the president’s lack of pressure on Israel Shortly after the news broke, Trump posted on Truth Social: “We have a deal for the hostages in the Middle East. They will be released shortly. Thank you!” While the former officials celebrated the proposed pause in fighting, Sheline said she believed Trump’s interest in forging peace may not last beyond his inauguration. “Unfortunately, I think that Trump just wants this for his inauguration. It will be a temporary reprieve. That is to be celebrated, but I expect that Israel will resume its genocidal campaign of violence as soon as the inauguration is over and Trump has been able to say ‘I did what Biden couldn’t,’” she said. She added that it was in Netanyahu’s interests to give Trump a win because he has long-term plans for other parts of the Palestinian territories that will require Trump’s support. “There is likely an understanding that Trump will help him get what he wants, that being the annexation of the West Bank,” she said. Paul, too, expressed caution. “As important as a ceasefire is, what is even more important is what comes next: not only must the ceasefire be maintained, but there must be a real effort, backed by an international commitment, to surge humanitarian assistance into Gaza, to pursue justice and accountability on behalf of all who have suffered since and before October 2023, to begin rebuilding the lost cities and towns of Gaza, and to achieve a just and lasting peace,” he said. Habash said his initial reaction was that the deal was “great news” and urged more action. “We should all be celebrating the end to violence that continues to perpetuate the unequal treatment of all people,” he said. “And I think if there is a deal that can both stop the killing of Palestinian civilians, stop the starvation, and also return hostages, both Palestinian and Israeli, I think that is extremely important in a step towards lasting peace.”"
31,Trump Family and Friends Don’t Like Don Jr.’s New Girlfriend,"0    https://www.yahoo.com/entertainment/trump-fami...
Name: Link, dtype: object","President-elect Donald Trump isn’t convinced Florida socialite Bettina Anderson is a good fit for Donald Trump Jr. following his split from MAGA “mamacita” Kimberly Guilfoyle. Sources told Mediaite that the president-elect and his advisers worry Anderson’s partying ways could hurt Don Jr. “Individuals close to the president have expressed growing concerns about the potential liability posed by his son’s new relationship,” a Trump family friend told Mediaite on Monday. The family friend added, “I told him that she’s not someone he should be around, and let him know about her past.” Don Jr. was allegedly warned that Anderson has a history of parading around with wealthy men in Palm Beach, but Anderson’s camp has denied such claims, according to Mediaite. “Donald Trump does not approve of his son’s association with Bettina,” another “close family friend” claimed. “Bettina’s presence is seen as a liability rather than an asset.” Anderson was seated behind Don Jr. and Guilfoyle, among other Trump family members, at the 2024 Republican National Convention in Milwaukee. The comments from family sources seem to be a far cry from what the president-elect has openly said about Guilfoyle, who actively worked publicly and privately as MAGA’s mouthpiece in fundraising. Now that Guilfoyle has been booted from Don Jr.’s orbit with a plush ambassadorship post in Greece, pending Senate confirmation, sources close to the Trump family clan are hinting at some buyer’s remorse. If Don Jr. brings Anderson as his date to Trump’s Jan. 20 inauguration, it could permanently tie her to the first family in the public’s eye. “The idea that he might have the audacity to bring a casual partner on stage at the inauguration has been described as a potential misstep that could etch this relationship, and its questionable nature, into the history books,” said the family friend."
